{"$id":"urn:mission-kit:survey-skill-evaluator:campaign-input","$schema":"https://json-schema.org/draft/2020-12/schema","additionalProperties":false,"properties":{"analysisPlanRef":{"minLength":1,"pattern":"^(?!/)(?!.*(?:^|/)\\.\\.(?:/|$))[^\\\\\\u0000]+$","type":"string"},"arms":{"items":{"additionalProperties":false,"properties":{"armId":{"pattern":"^[A-Za-z0-9][A-Za-z0-9._:/-]{0,255}$","type":"string"},"conditionClass":{"pattern":"^[A-Za-z0-9][A-Za-z0-9._:/-]{0,255}$","type":"string"},"environmentDigest":{"pattern":"^[a-f0-9]{64}$","type":"string"},"snapshotRef":{"minLength":1,"pattern":"^(?!/)(?!.*(?:^|/)\\.\\.(?:/|$))[^\\\\\\u0000]+$","type":"string"}},"required":["armId","conditionClass","environmentDigest","snapshotRef"],"type":"object"},"minItems":2,"type":"array","uniqueItems":true},"campaignId":{"pattern":"^[A-Za-z0-9][A-Za-z0-9._:/-]{0,255}$","type":"string"},"claims":{"items":{"additionalProperties":false,"properties":{"claimClass":{"enum":["upgrade-effect","absolute-leverage","variant-selection","mechanism-attribution","robustness","efficiency","downstream-utility"]},"claimId":{"pattern":"^[A-Za-z0-9][A-Za-z0-9._:/-]{0,255}$","type":"string"},"controlArmId":{"pattern":"^[A-Za-z0-9][A-Za-z0-9._:/-]{0,255}$","type":"string"},"text":{"maxLength":4000,"minLength":1,"type":"string"},"treatmentArmId":{"pattern":"^[A-Za-z0-9][A-Za-z0-9._:/-]{0,255}$","type":"string"}},"required":["claimId","text","claimClass","treatmentArmId","controlArmId"],"type":"object"},"minItems":1,"type":"array","uniqueItems":true},"controlAuditPolicy":{"additionalProperties":false,"properties":{"allowedDifferencePaths":{"items":{"pattern":"^\\$(?:\\.[A-Za-z0-9_-]+|\\[[0-9]+\\])*$","type":"string"},"type":"array","uniqueItems":true},"controlArmId":{"pattern":"^[A-Za-z0-9][A-Za-z0-9._:/-]{0,255}$","type":"string"},"expectedDirectionVisibleToAuditor":{"const":false},"forbiddenDifferencePaths":{"items":{"pattern":"^\\$(?:\\.[A-Za-z0-9_-]+|\\[[0-9]+\\])*$","type":"string"},"type":"array","uniqueItems":true},"forbiddenDoctrineTerms":{"items":{"maxLength":256,"minLength":1,"type":"string"},"type":"array","uniqueItems":true},"manipulatedMechanismId":{"pattern":"^[A-Za-z0-9][A-Za-z0-9._:/-]{0,255}$","type":"string"},"treatmentArmId":{"pattern":"^[A-Za-z0-9][A-Za-z0-9._:/-]{0,255}$","type":"string"}},"required":["treatmentArmId","controlArmId","manipulatedMechanismId","allowedDifferencePaths","forbiddenDifferencePaths","forbiddenDoctrineTerms","expectedDirectionVisibleToAuditor"],"type":"object"},"dependencePlanRef":{"minLength":1,"pattern":"^(?!/)(?!.*(?:^|/)\\.\\.(?:/|$))[^\\\\\\u0000]+$","type":"string"},"hashProfileId":{"const":"survey-evaluator-sha256-jcs-v1"},"population":{"additionalProperties":false,"properties":{"strata":{"items":{"additionalProperties":false,"properties":{"stratumId":{"pattern":"^[A-Za-z0-9][A-Za-z0-9._:/-]{0,255}$","type":"string"},"weight":{"maximum":1,"minimum":0,"type":"number"}},"required":["stratumId","weight"],"type":"object"},"type":"array","uniqueItems":true},"target":{"pattern":"^[A-Za-z0-9][A-Za-z0-9._:/-]{0,255}$","type":"string"}},"required":["target","strata"],"type":"object"},"promotionAuthorized":{"const":false},"scenarioRefs":{"items":{"minLength":1,"pattern":"^(?!/)(?!.*(?:^|/)\\.\\.(?:/|$))[^\\\\\\u0000]+$","type":"string"},"minItems":1,"type":"array","uniqueItems":true},"schemaVersion":{"pattern":"^\\d+\\.\\d+\\.\\d+$","type":"string"},"stoppingRuleRef":{"minLength":1,"pattern":"^(?!/)(?!.*(?:^|/)\\.\\.(?:/|$))[^\\\\\\u0000]+$","type":"string"},"useClass":{"enum":["diagnostic","calibration","pilot","exploratory","confirmatory","assurance"]}},"required":["schemaVersion","hashProfileId","campaignId","useClass","claims","arms","scenarioRefs","population","controlAuditPolicy","analysisPlanRef","dependencePlanRef","stoppingRuleRef","promotionAuthorized"],"title":"campaign-input","type":"object"}