{"analysisPlanRef":"analysis-plan.json","arms":[],"campaignId":"replace-with-deterministic-id","claims":[],"controlAuditPolicy":{"allowedDifferencePaths":[],"controlArmId":"replace-with-control-arm-id","expectedDirectionVisibleToAuditor":false,"forbiddenDifferencePaths":[],"forbiddenDoctrineTerms":[],"manipulatedMechanismId":"replace-with-mechanism-id","treatmentArmId":"replace-with-treatment-arm-id"},"dependencePlanRef":"dependence-plan.json","hashProfileId":"survey-evaluator-sha256-jcs-v1","population":{"strata":[],"target":"declare-before-seal"},"promotionAuthorized":false,"scenarioRefs":[],"schemaVersion":"1.0.0","stoppingRuleRef":"stopping-rule.json","useClass":"diagnostic"}